{"schemaVersion":1,"eventId":"evt_1","eventType":"execution.reported.v1","occurredAt":"2026-10-12T14:45:05Z","aggregateId":"ord_1","aggregateVersion":2,"traceId":"4bf92f3577b34da6a3ce929d0e0e4736","payload":{"schemaVersion":1,"id":"rep_1","orderId":"ord_1","status":"UNKNOWN","requestedQuantity":"1.25","filledQuantity":"0","reconciliation":"PENDING","reasonCode":"BROKER_STATUS_UNKNOWN","occurredAt":"2026-10-12T14:45:05Z","receivedAt":"2026-10-12T14:45:06Z","traceId":"4bf92f3577b34da6a3ce929d0e0e4736"}}
